{
  "$schema": "../schema/relevance.schema.json",
  "titleMultiplier": 2.0,
  "minScoreToInclude": 5,
  "authorBoosts": {},
  "cpcBoosts": {
    "G06N10": 10,
    "H10N60": 10,
    "H10N69": 9,
    "H03K19/195": 9,
    "G06N10/40": 10,
    "H01L39": 8,
    "B82Y10": 6
  },
  "assigneeBoosts": {},
  "profiles": {
    "materials": {
      "focus": 1.0,
      "keywords": {
        "superconducting qubit": 10,
        "loss tangent": 10,
        "dielectric loss": 10,
        "materials loss": 9,
        "surface oxide": 9,
        "internal quality": 9,
        "tantalum": 7,
        "niobium": 8,
        "NbN": 7,
        "NbTiN": 8,
        "granular aluminum": 9,
        "granular aluminium": 9,
        "AlOx": 6,
        "high-resistivity silicon": 8,
        "josephson junction": 8,
        "superconducting film": 7,
        "coplanar waveguide": 7,
        "CPW": 6,
        "microwave resonator": 7,
        "superconducting resonator": 9,
        "kinetic inductance": 8,
        "superinductor": 8,
        "3D cavity": 6,
        "superconducting": 3,
        "Josephson": 3,
        "superconducting nanowire": 6,
        "SNSPD": 5
      }
    },
    "coherence": {
      "focus": 1.0,
      "keywords": {
        "transmon": 9,
        "fluxonium": 9,
        "gatemon": 7,
        "0-π": 7,
        "0-pi qubit": 7,
        "cat qubit": 5,
        "Kerr-cat": 6,
        "dual-rail": 4,
        "two-level-system": 7,
        "quasiparticle poisoning": 9,
        "quasiparticle tunneling": 6,
        "flux noise": 8
      }
    },
    "general_scq": {
      "focus": 1.0,
      "keywords": {
        "superconducting circuit": 8,
        "superconducting quantum": 7,
        "circuit QED": 8,
        "cQED": 8,
        "quantum processor": 2,
        "quantum computing": 1,
        "dilution refrigerator": 3
      }
    },
    "sc_context": {
      "focus": 1.0,
      "requires": ["superconduct", "transmon", "fluxonium", "Josephson", "SQUID", "circuit QED", "cQED", "kinetic inductance", "Cooper pair", "NbTiN", "NbN", "gatemon"],
      "keywords": {
        "coherence": 3,
        "coherence time": 5,
        "decoherence": 2,
        "dephasing": 3,
        "relaxation": 1,
        "energy relaxation": 4,
        "noise": 1,
        "charge noise": 4,
        "1/f noise": 3,
        "two-level system": 5,
        "TLS": 7,
        "T1": 7,
        "T2": 6,
        "quasiparticle": 5,
        "purcell": 5,
        "ionizing radiation": 5,
        "cosmic ray": 4,
        "qubit": 2,
        "resonator": 3,
        "quality factor": 5,
        "thin film": 4,
        "substrate": 3,
        "sapphire": 5,
        "silicon substrate": 5,
        "epitaxial": 4,
        "microwave cavity": 5,
        "native oxide": 7,
        "surface treatment": 8,
        "aluminum oxide": 6,
        "aluminium oxide": 6,
        "Nb": 5,
        "TiN": 7
      }
    },
    "fabrication": {
      "focus": 1.0,
      "requires": ["superconduct", "transmon", "fluxonium", "Josephson", "SQUID", "circuit QED", "cQED", "kinetic inductance", "Cooper pair", "NbTiN", "NbN", "gatemon"],
      "keywords": {
        "fabricat": 4,
        "junction fabrication": 8,
        "shadow evaporation": 8,
        "Dolan bridge": 8,
        "Manhattan": 5,
        "lithograph": 4,
        "lift-off": 4,
        "reactive ion etch": 5,
        "wet etch": 5,
        "etch": 3,
        "anneal": 4,
        "sputter": 6,
        "molecular beam epitaxy": 7,
        "MBE": 6,
        "atomic layer deposition": 6,
        "ALD": 5,
        "e-beam evaporation": 6,
        "evaporation": 3,
        "deposition": 3,
        "air bridge": 7,
        "airbridge": 7,
        "through-silicon via": 8,
        "TSV": 7,
        "flip-chip": 7,
        "bump bond": 8,
        "indium bump": 8,
        "wafer": 3,
        "300 mm": 5,
        "foundry": 6,
        "CMOS-compatible": 5,
        "damascene": 7,
        "trilayer": 6,
        "tunnel barrier": 7,
        "capping layer": 7,
        "encapsulat": 5,
        "passivation": 5
      }
    },
    "characterization": {
      "focus": 1.0,
      "requires": ["superconduct", "transmon", "fluxonium", "Josephson", "SQUID", "circuit QED", "cQED", "kinetic inductance", "Cooper pair", "NbTiN", "NbN", "gatemon"],
      "keywords": {
        "XPS": 6,
        "x-ray photoelectron": 6,
        "ARXPS": 7,
        "EELS": 6,
        "electron energy loss": 6,
        "TEM": 5,
        "STEM": 5,
        "AFM": 4,
        "STM": 4,
        "ellipsometry": 5,
        "x-ray reflectivity": 6,
        "XRR": 6,
        "SIMS": 6,
        "secondary ion mass": 6,
        "transport measurement": 4,
        "sheet resistance": 5,
        "residual resistivity ratio": 7,
        "RRR": 6,
        "critical temperature": 4,
        "tunneling spectroscopy": 5,
        "penetration depth": 5,
        "superconducting gap": 3
      }
    },
    "readout": {
      "focus": 1.0,
      "requires": ["superconduct", "transmon", "fluxonium", "Josephson", "SQUID", "circuit QED", "cQED", "kinetic inductance", "Cooper pair", "NbTiN", "NbN", "gatemon"],
      "keywords": {
        "parametric amplif": 7,
        "JPA": 7,
        "TWPA": 7,
        "traveling-wave parametric": 7,
        "dispersive readout": 7,
        "readout resonator": 6,
        "quantum-limited": 5
      }
    },
    "gates": {
      "focus": 1.0,
      "requires": ["superconduct", "transmon", "fluxonium", "Josephson", "SQUID", "circuit QED", "cQED", "kinetic inductance", "Cooper pair", "NbTiN", "NbN", "gatemon"],
      "keywords": {
        "gate fidelity": 5,
        "optimal control": 3,
        "DRAG": 5,
        "leakage": 2,
        "cross-resonance": 7,
        "tunable coupler": 7,
        "iSWAP": 5
      }
    },
    "off_topic": {
      "focus": 1.0,
      "keywords": {
        "variational quantum eigensolver": -6,
        "VQE": -5,
        "QAOA": -6,
        "quantum approximate optimization": -6,
        "Grover": -4,
        "quantum advantage": -5,
        "quantum supremacy": -5,
        "quantum machine learning": -5,
        "quantum neural network": -5,
        "quantum chemistry": -4,
        "quantum simulation": -3,
        "variational ansatz": -5,
        "barren plateau": -5,
        "spin qubit": -6,
        "quantum dot": -3,
        "singlet-triplet": -4,
        "donor spin": -4,
        "hole spin": -4,
        "Si/SiGe": -4,
        "cuprate": -3,
        "nickelate": -3,
        "kagome": -3,
        "iron-based": -3,
        "heavy-fermion": -3,
        "unconventional superconductivity": -3,
        "pairing symmetry": -2,
        "d-wave": -2
      }
    }
  }
}
